{
    "brief_id": "brief_5a11bbf89436675e",
    "report_id": "rr_m7-consultant-liability",
    "decision_id": "dec_726d75c366d569aa",
    "strategy_id": "strat_1fa6e1f92f0119d0",
    "schema_version": "1.0",
    "lifecycle_stage": "content_brief_ready",
    "content_type": "guide",
    "primary_keyword": "consultant professional liability insurance",
    "search_intent": "informational",
    "audience": "Readers seeking clear, trustworthy insurance information",
    "objective": "Build qualified organic traffic and provide trustworthy insurance guidance.",
    "title_direction": "Use the primary topic 'consultant professional liability insurance' with a clear, benefit-led guide framing; do not treat this as a final headline.",
    "outline": [
        {
            "heading": "Introduction",
            "purpose": "Address the 'Introduction' requirement from the approved content strategy without introducing unsupported claims."
        },
        {
            "heading": "What You Need to Know",
            "purpose": "Address the 'What You Need to Know' requirement from the approved content strategy without introducing unsupported claims."
        },
        {
            "heading": "Coverage and Key Factors",
            "purpose": "Address the 'Coverage and Key Factors' requirement from the approved content strategy without introducing unsupported claims."
        },
        {
            "heading": "Costs and Pricing Factors",
            "purpose": "Address the 'Costs and Pricing Factors' requirement from the approved content strategy without introducing unsupported claims."
        },
        {
            "heading": "How to Compare Options",
            "purpose": "Address the 'How to Compare Options' requirement from the approved content strategy without introducing unsupported claims."
        },
        {
            "heading": "Frequently Asked Questions",
            "purpose": "Address the 'Frequently Asked Questions' requirement from the approved content strategy without introducing unsupported claims."
        },
        {
            "heading": "Sources and Editorial Methodology",
            "purpose": "Address the 'Sources and Editorial Methodology' requirement from the approved content strategy without introducing unsupported claims."
        }
    ],
    "required_entities": [],
    "required_questions": [
        "{'text': 'Professional Liability Insurance for Consultants | The Hartford', 'source_position': 2, 'count': 1}",
        "{'text': 'Independent Consultant/Non-Specialist Professional Services Providers | Cornell', 'source_position': 3, 'count': 1}",
        "{'text': 'Professional Liability Insurance FAQs | The Hartford', 'source_position': 4, 'count': 1}"
    ],
    "evidence_refs": [
        "ev_9a2aedbda182447f",
        "ev_serp_result_e444932ffdbdcf4c",
        "ev_serp_result_ff1b4f79644246be",
        "ev_serp_result_a313311899a979c3",
        "ev_serp_result_c1d68f3c48a13f97",
        "ev_serp_result_cba8fb55be152463",
        "ev_serp_distribution_5bd5f8181a2685d0",
        "ev_serp_dominant_5bd5f8181a2685d0",
        "ev_serp_mixed_5bd5f8181a2685d0",
        "ev_intent_alignment_b80d94868d8444df",
        "ev_serp_strategy_ad409d2a44c3792b",
        "ev_b68e2e74a3d8d68d7f0b6f28",
        "ev_d0ee01a51f13063e7d47c3d3",
        "ev_f27f204e172f0bc28f509ce8",
        "ev_ad6b4817da573d3539e55967",
        "ev_7be8f8d28256603c97e78523",
        "ev_9e4fd2bf505c53588b7dca01",
        "ev_75c4849a49f1e0ec17c3ca9d",
        "ev_3c101e172deffec73fc173d2",
        "ev_e08d48a1e6c8769e7f384c56",
        "ev_11d67e0727eee22468ec7721",
        "ev_c4d36efbb9712e7962801f0a",
        "ev_4facf32aac256200c3945fd1",
        "ev_aacb3b16843de77896baf355",
        "ev_c6ca61471538bfcf327d46a6",
        "ev_99663307d0614f16c33e393b",
        "ev_e4c24c3305be8fd806939e56",
        "ev_b157e1257743122ff7d6c68b",
        "ev_db081695cfad6d9d69e187b8",
        "ev_259d00013793f1213fcd7cd7"
    ],
    "editorial_constraints": [
        "Use evidence_refs as the authoritative upstream lineage for factual claims.",
        "Do not invent providers, prices, coverage terms, statistics, or regulatory claims absent supporting evidence.",
        "Do not make the brief itself a final article draft; prose generation belongs to the Writer layer.",
        "Do not change the approved Decision or create a new operational decision."
    ],
    "audit": {
        "method": "content_strategy_to_content_brief",
        "version": "v1",
        "validation_status": "pending"
    }
}