{
    "brief_id": "brief_cdeb974c02e6d07e",
    "report_id": "rr_expat-health-insurance",
    "decision_id": "dec_f2ee50bddcd3057d",
    "strategy_id": "strat_1c4fbf8d9fb4d4fe",
    "schema_version": "1.0",
    "lifecycle_stage": "content_brief_ready",
    "content_type": "guide",
    "primary_keyword": "expat health insurance",
    "search_intent": "informational",
    "audience": "Readers seeking clear, trustworthy insurance information",
    "objective": "Build qualified organic traffic and provide trustworthy insurance guidance.",
    "title_direction": "Use the primary topic 'expat health insurance' with a clear, benefit-led guide framing; do not treat this as a final headline.",
    "outline": [
        {
            "heading": "Introduction",
            "purpose": "Address the 'Introduction' requirement from the approved content strategy without introducing unsupported claims."
        },
        {
            "heading": "What You Need to Know",
            "purpose": "Address the 'What You Need to Know' requirement from the approved content strategy without introducing unsupported claims."
        },
        {
            "heading": "Coverage and Key Factors",
            "purpose": "Address the 'Coverage and Key Factors' requirement from the approved content strategy without introducing unsupported claims."
        },
        {
            "heading": "Costs and Pricing Factors",
            "purpose": "Address the 'Costs and Pricing Factors' requirement from the approved content strategy without introducing unsupported claims."
        },
        {
            "heading": "How to Compare Options",
            "purpose": "Address the 'How to Compare Options' requirement from the approved content strategy without introducing unsupported claims."
        },
        {
            "heading": "Frequently Asked Questions",
            "purpose": "Address the 'Frequently Asked Questions' requirement from the approved content strategy without introducing unsupported claims."
        },
        {
            "heading": "Sources and Editorial Methodology",
            "purpose": "Address the 'Sources and Editorial Methodology' requirement from the approved content strategy without introducing unsupported claims."
        }
    ],
    "required_entities": [],
    "required_questions": [
        "{'text': 'Expat Health Insurance for Professionals', 'source_position': 3, 'count': 1}",
        "{'text': 'Expat Medical/Health Insurance', 'source_position': 4, 'count': 2}",
        "{'text': 'Do I Need Health Insurance Living Abroad? Expat Guide', 'source_position': 7, 'count': 2}",
        "{'text': 'Global Expat Health Insurance Explained', 'source_position': 8, 'count': 1}",
        "{'text': 'International Health Insurance Coverage for Living Abroad', 'source_position': 10, 'count': 1}",
        "{'text': 'Expatriate health insurance in the United States', 'source_position': 11, 'count': 1}"
    ],
    "evidence_refs": [
        "ev_454e683da39cd64e",
        "ev_serp_result_8c55baaa568b274e",
        "ev_serp_result_9fca0aafc956a04f",
        "ev_serp_result_27c34d1b9fd94a85",
        "ev_serp_result_934b1f0f571fbebc",
        "ev_serp_result_45fad6e64d09c0fa",
        "ev_serp_result_ec809fb47b6a343c",
        "ev_serp_result_4413a1140f635b3d",
        "ev_serp_result_1872aaa543564c6b",
        "ev_serp_result_892a0c39ffc23f0e",
        "ev_serp_distribution_23165a6f509de19b",
        "ev_serp_dominant_23165a6f509de19b",
        "ev_serp_mixed_23165a6f509de19b",
        "ev_intent_alignment_91b405f6a64df87f",
        "ev_serp_strategy_233923c86c15a3ff",
        "ev_1f7c321cdd7bbdefe1b7855f",
        "ev_66f8572090e5cf1c0bb2a707",
        "ev_13ef75e026eb0bd9b79113c1",
        "ev_50e9829c101f7598b6abbed2",
        "ev_e46114e2a051b4e33b77ea50",
        "ev_28b89e80c06138321f65204e",
        "ev_4912cc056c11898cfd31b559",
        "ev_41ce894922a669e77259fe8d",
        "ev_a4f6407a46d260fa22115039",
        "ev_bc9ff3dcb9f285126eaa9056",
        "ev_9b0ec503dd8840276bbd1920",
        "ev_e0a5ce381840068fecf3b3df",
        "ev_966b60767ec46c4b67169fe5",
        "ev_c8691b781dd1015730fd7ed9",
        "ev_95b314fd4ffaf1a9d24ca9f3",
        "ev_d5eaa5677934b1b915cd1bdc",
        "ev_3208ff0460e2eac3dbfb4281",
        "ev_63d7e6223b14df00ac60858a",
        "ev_1c9e5d9ea6c70ffa5f47e7b9",
        "ev_8339719bc6939f1323a34b60",
        "ev_ed51b02715143f81635f7151",
        "ev_f6c60ce0bfdde4c3d62c2f96",
        "ev_8524552715be757833bbad8b",
        "ev_4f502e2cf646837ad3f36c8d",
        "ev_34d5b8c82a8a2b98aee648dc",
        "ev_1bf31d73d0b60edf2c380eb9",
        "ev_07fc4e7394d17a0f39bcc541",
        "ev_f84050d29bd3788b8db432d4",
        "ev_b633ce73305b1d2c88449135",
        "ev_d0907041f5ed42b9daf437e3",
        "ev_7b92ea8033047a27cfc7dd90",
        "ev_45682e20adad3758e08109db",
        "ev_7728da4194f34bd5e6a1cf77",
        "ev_a55b2cd0b14d31d8f94c3634"
    ],
    "editorial_constraints": [
        "Use evidence_refs as the authoritative upstream lineage for factual claims.",
        "Do not invent providers, prices, coverage terms, statistics, or regulatory claims absent supporting evidence.",
        "Do not make the brief itself a final article draft; prose generation belongs to the Writer layer.",
        "Do not change the approved Decision or create a new operational decision."
    ],
    "audit": {
        "method": "content_strategy_to_content_brief",
        "version": "v1",
        "validation_status": "pending"
    }
}